{
  "basics": [
    {
      "fname": "Test",
      "lname": "User",
      "email": "test@example.com",
      "label": ["Software Engineer"],
      "location": [
        {
          "city": "Berlin",
          "country": "Germany"
        }
      ],
      "phone": {"formatted": "+49 123 456789"}
    }
  ],
  "profiles": [],
  "education": [],
  "experiences": [],
  "skills": {},
  "languages": [],
  "projects": [],
  "publications": [],
  "references": [],
  "workshop_and_certifications": []
}
