{
  "basics": [
    {
      "fname": "تست",
      "lname": "شخص",
      "email": "test@example.com",
      "label": ["مهندس نرم‌افزار"],
      "summary": "یک مهندس نرم‌افزار با تجربه در زبان‌های برنامه‌نویسی مختلف.",
      "location": [
        {
          "city": "برلین",
          "country": "آلمان"
        }
      ],
      "phone": {"formatted": "+49 123 456789"}
    }
  ],
  "profiles": [],
  "education": [
    {
      "institution": "دانشگاه فنی",
      "location": "برلین، آلمان",
      "area": "علوم کامپیوتر",
      "studyType": "کارشناسی ارشد",
      "startDate": "2018-10-01",
      "endDate": "2020-09-30",
      "type_key": ["رزومه کامل"]
    },
    {
      "institution": "دانشگاه دولتی",
      "location": "مونیخ، آلمان",
      "area": "ریاضیات",
      "studyType": "کارشناسی",
      "startDate": "2014-10-01",
      "endDate": "2018-07-30",
      "type_key": ["رزومه کامل"]
    }
  ],
  "languages": [
    {
      "language": "فارسی",
      "proficiency": {
        "level": "زبان مادری",
        "CEFR": null,
        "status": "زبان مادری"
      },
      "certifications": []
    }
  ],
  "workshop_and_certifications": [],
  "skills": {
    "برنامه‌نویسی و اسکریپت‌نویسی": {
      "زبان‌های برنامه‌نویسی": [
        {
          "long_name": "پایتون",
          "short_name": "Python",
          "type_key": ["رزومه کامل"]
        },
        {
          "long_name": "جاوااسکریپت",
          "short_name": "JS",
          "type_key": ["رزومه کامل"]
        }
      ]
    },
    "مهارت‌های نرم": {
      "مهارت‌های نرم اصلی": [
        {
          "long_name": "همکاری تیمی",
          "short_name": "Teamwork",
          "type_key": ["رزومه کامل"]
        }
      ]
    }
  },
  "experiences": [
    {
      "role": "مهندس نرم‌افزار",
      "institution": "شرکت فناوری",
      "duration": "۲۰۲۰-۱۰-۰۱ - اکنون",
      "description": "توسعه برنامه‌های ابری."
    }
  ],
  "projects": [
    {
      "title": "پروژه متن‌باز",
      "description": "یک کتابخانه متن‌باز برای پردازش داده‌ها.",
      "url": "https://github.com/example/project",
      "type_key": ["رزومه کامل", "برنامه‌نویسی"]
    },
    {
      "title": "پروژه تحقیقاتی",
      "description": "تحقیقات در زمینه یادگیری ماشین.",
      "url": null,
      "type_key": ["رزومه کامل", "آکادمیک"]
    }
  ],
  "publications": [],
  "references": []
}
