{
  "basics": [
    {
      "fname": "Test",
      "lname": "Person",
      "email": "test@example.com",
      "label": ["Software Engineer"],
      "summary": "A software engineer with experience in multiple programming languages.",
      "location": [
        {
          "city": "Berlin",
          "country": "Germany"
        }
      ],
      "phone": {"formatted": "+49 123 456789"}
    }
  ],
  "profiles": [],
  "education": [
    {
      "institution": "Technical University",
      "location": "Berlin, Germany",
      "area": "Computer Science",
      "studyType": "Master's",
      "startDate": "2018-10-01",
      "endDate": "2020-09-30",
      "type_key": ["Full CV"]
    },
    {
      "institution": "State University",
      "location": "Munich, Germany",
      "area": "Mathematics",
      "studyType": "Bachelor's",
      "startDate": "2014-10-01",
      "endDate": "2018-07-30",
      "type_key": ["Full CV"]
    }
  ],
  "languages": [
    {
      "language": "English",
      "proficiency": {
        "level": "Native",
        "CEFR": null,
        "status": "Native speaker"
      },
      "certifications": []
    }
  ],
  "workshop_and_certifications": [],
  "skills": {
    "Programming & Scripting": {
      "Programming Languages": [
        {
          "long_name": "Python",
          "short_name": "Python",
          "type_key": ["Full CV"]
        },
        {
          "long_name": "JavaScript",
          "short_name": "JS",
          "type_key": ["Full CV"]
        }
      ]
    },
    "Soft Skills": {
      "Core Soft Skills": [
        {
          "long_name": "Team Collaboration",
          "short_name": "Teamwork",
          "type_key": ["Full CV"]
        }
      ]
    }
  },
  "experiences": [
    {
      "role": "Software Engineer",
      "institution": "Tech Company",
      "duration": "2020-10-01 - present",
      "description": "Developing cloud-native applications."
    }
  ],
  "projects": [
    {
      "title": "Open Source Project",
      "description": "An open source library for data processing.",
      "url": "https://github.com/example/project",
      "type_key": ["Full CV", "Programming"]
    },
    {
      "title": "Research Project",
      "description": "Research on machine learning.",
      "url": null,
      "type_key": ["Full CV", "Academic"]
    }
  ],
  "publications": [],
  "references": []
}
