{
  "basics": [
    {
      "fname": "Ramin",
      "lname": "Yazdani",
      "email": "test@example.com"
    }
  ],
  "education": [
    {
      "institution": "University A",
      "area": "Computer Science",
      "studyType": "Master's",
      "type_key": ["Full CV"]
    }
  ],
  "skills": {
    "Programming & Scripting": {
      "Programming Languages": [
        {
          "long_name": "Python",
          "short_name": "Python",
          "type_key": ["Full CV"]
        },
        {
          "long_name": "JavaScript",
          "short_name": "JS",
          "type_key": ["Full CV"]
        }
      ]
    },
    "Soft Skills": {
      "Core Soft Skills": [
        {
          "long_name": "Team Collaboration",
          "short_name": "Teamwork",
          "type_key": ["Full CV"]
        }
      ]
    }
  },
  "experiences": [
    {
      "role": "Developer",
      "institution": "Company A",
      "duration": "2020-01-01 - 2022-01-01",
      "description": "Developed software"
    }
  ],
  "projects": [
    {
      "title": "Project One",
      "description": "First project",
      "url": "https://github.com/example/project1"
    },
    {
      "title": "Project Two",
      "description": "Second project",
      "url": null
    }
  ]
}
